{
  "evidence_id": "base-sdk013-restart",
  "issue_id": "appsdk-013-migration",
  "experiment_id": "base-sdk013-experiment",
  "phase": "deployment_restart",
  "kind": "restart",
  "source_commit": "555bee59c61e0b3bbfa782fc8893cb355ac87eb8",
  "artifact_hash": "sha256:4a3ce587796ad4bb00a412bda00cecfd03315283af54ae9f54f5c6fb1ba26bfd",
  "execution_surface": "deployed_blackbox",
  "environment_id": "v4-local-worktree",
  "entrypoint": "cargo test -p routecodex-v4-base-node",
  "scope": {
    "module_id": "routecodex-v4-base-node",
    "feature_id": "v4.appsdk-013-migration",
    "entrypoint": "cargo test -p routecodex-v4-base-node"
  },
  "producer": {
    "adapter": "cargo",
    "identity": "routecodex-v4-base-node"
  },
  "result": "pass",
  "created_at": "2026-08-22T05:40:03Z",
  "expires_at": "2026-08-24T12:00:00Z",
  "input_hashes": [],
  "scope_hash": "sha256:7d1e6dda7043dedd559eb5c13df6ae94d7c49165b54e4602ecbd29ad5c6c6de9"
}
