{"evidence_id":"v4-cordis-plugin-contract-positive-r3","issue_id":"v4-cordis-plugin-contract-rebuild-current","experiment_id":"v4-cordis-plugin-contract-worktree-current","phase":"positive_intervention","kind":"positive_test","source_commit":"4944a2fafe8349102a625cef502ba02b414e5db8","artifact_hash":"sha256:308725f4606c2751f861efe5401f63b57fab38a8c3fb827cc6958e06a70a9ff3","execution_surface":"development_whitebox","scope":{"module_id":"routecodex-v4-plugin-contract","feature_id":"v4-cordis-plugin-contract-rebuild-current","entrypoint":"cargo test --locked --offline -p routecodex-v4-plugin-contract"},"producer":{"adapter":"cargo","identity":"v4-cordis-plugin-contract-l2"},"result":"pass","confidence":1,"confidence_rationale":"Current candidate positive regression suite passed.","created_at":"2026-08-29T14:00:30Z","expires_at":"2026-09-05T14:00:30Z","input_hashes":["sha256:308725f4606c2751f861efe5401f63b57fab38a8c3fb827cc6958e06a70a9ff3"],"scope_hash":"sha256:226734beb3e1c3b24eb46f9695ae9501298458b87bb04d49199b1908c59ef24b"}
