{"evidence_id":"edge-sdk013-prereview-blackbox","issue_id":"appsdk-013-migration","experiment_id":"edge-sdk013-experiment","phase":"deployed_blackbox","kind":"sample_replay","source_commit":"73a427ee5e4a529cc16890cdb8b4a1b5940704c9","artifact_hash":"sha256:83728d3d7967db171cfb627301ba8e8d636eaf6015101f70e316a5234c260ea6","execution_surface":"deployed_blackbox","environment_id":"v4-local-worktree","entrypoint":"cargo run --quiet --release -p routecodex-v4-build-link -- test-consumer","scope":{"module_id":"routecodex-v4-edge","feature_id":"v4.appsdk-013-migration","entrypoint":"cargo run --quiet --release -p routecodex-v4-build-link -- test-consumer"},"producer":{"adapter":"cargo","identity":"routecodex-v4-edge"},"result":"pass","created_at":"2026-08-22T05:45:04Z","expires_at":"2026-08-23T05:45:04Z","input_hashes":["sha256:a986908c5eb56e5b39d1e941f18c6f7b4f9fd41266285ac54139d9907119da96"],"scope_hash":"sha256:fb0002a89089b892f7c8323cb555a8d50d261bc125c4116b76578bc79c4520ad"}
