{"evidence_id":"v4-cordis-edge-baseline-current","issue_id":"v4-cordis-edge-fresh-governance","experiment_id":"v4-cordis-edge-current","phase":"baseline_reproduction","kind":"red_test","source_commit":"f2d53fd1c14eed3630e8b834a25409fbac8cf811","artifact_hash":"sha256:425b50dc8136d5920b21467d6efa4489f1cb10df9bc2ad87f519693b410d806c","execution_surface":"development_whitebox","scope":{"module_id":"routecodex-v4-edge"},"producer":{"adapter":"cargo","identity":"v4-cordis-edge-l1"},"result":"pass","created_at":"2026-08-28T04:56:10Z","expires_at":"2026-09-04T04:56:10Z","input_hashes":["sha256:e6bedbf34de4a84e5c2fbca3c36c077dac4514781f47cd499515594b89cb857d"],"scope_hash":"sha256:e6bedbf34de4a84e5c2fbca3c36c077dac4514781f47cd499515594b89cb857d"}
