{
  "evidence_id": "control-sdk013-restart",
  "issue_id": "appsdk-013-migration",
  "experiment_id": "control-sdk013-experiment",
  "phase": "deployment_restart",
  "kind": "restart",
  "source_commit": "555bee59c61e0b3bbfa782fc8893cb355ac87eb8",
  "artifact_hash": "sha256:e280965a718eeaaee59725a1703dd58b16a875b616e6b0e8c65bf5b2b4a28676",
  "execution_surface": "deployed_blackbox",
  "environment_id": "v4-local-worktree",
  "entrypoint": "cargo run --quiet --release -p routecodex-v4-build-link -- test-consumer",
  "scope": {
    "module_id": "routecodex-v4-control",
    "feature_id": "v4.appsdk-013-migration",
    "entrypoint": "cargo run --quiet --release -p routecodex-v4-build-link -- test-consumer"
  },
  "producer": {
    "adapter": "cargo",
    "identity": "routecodex-v4-control"
  },
  "result": "pass",
  "created_at": "2026-08-22T05:40:03Z",
  "expires_at": "2026-08-24T12:00:00Z",
  "input_hashes": [],
  "scope_hash": "sha256:b0e43a8443ea5ccdc5965bddd42853b26d884128f16cd04976453d75305a1559"
}
